384,03/10/2022,"[2221,2222]","[""glovo""]","[""glovo""]","[""sebastian-galassi"",""sebastian-galassi's-family""]","Delivery company Glovo's automated system sent an email terminating an employee for ""non-compliance terms and conditions"" after the employee was killed in a car accident while making a delivery on Glovo's behalf.",Glovo Driver in Italy Fired via Automated Email after Being Killed in Accident
385,04/10/2022,"[2224,2225,2231,2232,2233,2234]","[""edmonton-police-service""]","[""parabon-nanolabs""]","[""black-residents-in-edmonton""]","The Edmonton Police Service (EPS) in Canada released a facial image of a Black male suspect generated by an algorithm using DNA phenotyping, which was denounced by the local community as racial profiling.",Canadian Police's Release of Suspect's AI-Generated Facial Photo Reportedly Reinforced Racial Profiling
386,03/07/2019,"[2227,2228,2252]","[""amazon""]","[""amazon""]","[""amazon-warehouse-workers""]","Amazon's warehouse worker '“time off task"" (TOT) tracking system was used to discipline and dismiss workers, falsely assuming workers to have wasted time and failing to account for breaks or equipment issues.","Amazon's ""Time Off Task"" System Made False Assumptions about Workers' Time Management"
387,22/12/2014,[2229],"[""oracle""]","[""oracle""]","[""internet-users""]",Oracle's automated system involving algorithmic data processing was alleged in a lawsuit to have been unlawfully collecting personal data from millions of people and violating their privacy rights.,Oracle's Algorithmic Data Processing System Alleged as Unlawful and Violating Privacy Rights
388,01/12/2018,[2235],"[""the-government-in-bahia"",""bahia's-secretary-of-public-security""]","[""huawei""]","[""black-people-in-brazil"",""black-people-in-bahia""]",Facial recognition deployed in a pilot project by the local government of Bahia despite having minimal hit rate reportedly targeted Black and poor people disproportionately.,Facial Recognition Pilot in Bahia Reportedly Targeted Black and Poor People
391,26/07/2022,"[2244,2246]","[""southern-co-op""]","[""hikvision""]","[""souther-co-op-customers""]","Southern Co-op's use of facial recognition reportedly to curb violent crime in UK supermarkets was alleged by civil society and privacy groups as ""unlawful"" and ""complete"" invasion of privacy.",Facial Recognition Trial by UK Southern Co-op Alleged as Unlawful
395,02/03/2021,"[2254,2255,2256,2257]","[""amazon""]","[""netradyne""]","[""amazon-delivery-drivers""]","Amazon delivery drivers were forced to consent to algorithmic collection and processing of their location, movement, and biometric data through AI-powered cameras, or be dismissed.",Amazon Forced Deployment of AI-Powered Cameras on Delivery Drivers
396,04/07/2018,[2263],"[""uber""]","[""uber""]","[""transgender-uber-drivers""]",Transgender Uber drivers reported being automatically deactivated from the app due to Real-Time ID Check failing to account for difference in appearance of people undergoing gender transitions.,Transgender Uber Drivers Mistakenly Kicked off App for Appearance Change during Gender Transitions
404,25/06/2019,"[2284,2286]","[""rock-hill-schools"",""pinecrest-academy-horizon""]","[""sound-intelligence""]","[""students"",""rock-hill-school-students"",""pinecrest-academy-horizon-students""]","Sound Intelligence's ""aggression detection"" algorithm deployed by schools reportedly contained high rates of false positive, misclassifying laughing, coughing, cheering, and loud discussions.",Sound Intelligence's Aggression Detector Misidentified Innocuous Sounds
405,28/11/2018,"[2285,2287]","[""schufa-holding-ag""]","[""schufa-holding-ag""]","[""young-men-having-credit-scores"",""people-scored-on-old-scoring-versions"",""people-changing-addresses-frequently""]","Creditworthiness Schufa scores in Germany reportedly privileged older and female consumers, and people who changed addresses less frequently, and were unreliable depending on scoring version.",Schufa Credit Scoring in Germany Reported for Unreliable and Imbalanced Scores
407,03/02/2016,[2289],"[""uber""]","[""uber""]","[""poor-neighborhoods"",""neighborhoods-of-color""]",Uber's surge-pricing algorithm which adjusts prices to influence car availability inadvertently caused better service offering such as shorter wait times for majority white neighborhoods.,Uber's Surge Pricing Reportedly Offered Disproportionate Service Quality along Racial Lines
410,09/11/2022,[2312],"[""kfc""]","[""kfc""]","[""jewish-people""]",KFC cited an error in an automated holiday detection system which identified the anniversary of Kristallnacht and prompted an insensitive push notification promoting its chicken.,KFC Sent Insensitive Kristallnacht Promotion via Holiday Detection System
418,13/03/2017,"[2324,2391,2392]","[""uber""]","[""uber"",""azure-cognitive-services""]","[""uber-drivers-in-india""]",Uber drivers in India reported being locked out of their accounts allegedly due to Real-Time ID Check's facial recognition failing to recognize appearance changes or faces in low lighting conditions.,Uber Locked Indian Drivers out of Accounts Allegedly Due to Facial Recognition Fails
425,12/06/2021,"[2333,2385]","[""state-farm""]","[""state-farm""]","[""black-state-farm-customers""]",State Farm's automated claims processing method was alleged in a class action lawsuit to have disproportionately against Black policyholders when paying out insurance claims.,State Farm Allegedly Discriminated against Black Customers in Claim Payout
429,01/04/2016,"[2343,1816,2377,2378]","[""rochester-police-department""]","[""shotspotter""]","[""silvon-simmons""]","ShotSpotter's ""unreliable"" audio was used as scientific evidence to accuse and convict a Black man of attempting to shoot Rochester's city police, whose conviction was later reversed by a county judge.",Unreliable ShotSpotter Audio Convicted Black Rochester Man of Shooting Police
430,19/12/2022,"[2346,2355,2359,2360,2361,2362,2363,2364,2365,2366,2367,2368,2504,2556,2557,2589,2600,2665,2728,2775,2797]","[""madison-square-garden-entertainment""]","[""unknown""]","[""kelly-conlon"",""alexis-majano""]",Lawyers were barred from entry to Madison Square Garden after a facial recognition system matched them as employed by a law firm currently engaged in litigation with the venue.,Lawyers Denied Entry to Performance Venue by Facial Recognition
432,21/12/2022,[2357],"[""southwest-airlines""]","[""general-electric""]","[""airline-passengers""]",Southwest Airlines left passengers stranded for days throughout the flight network when Southwest crew scheduling software repeatedly failed to recover from weather-induced flight cancellations.,Southwest Airlines Crew Scheduling Solver Degenerates Flight Network
433,01/08/2012,"[2415,2416,1013,1348,1011,1018,1012,2421,2422]","[""chicago-police-department""]","[""chicago-police-department""]","[""low-income-communities"",""communities-of-color"",""black-chicago-residents""]","Chicago Police Department (CPD)'s Strategic Subject List as output of an algorithm purportedly to identify victims or perpetrators of violence was reportedly ineffective, easily abused, and biased against low-income communities of color.",Chicago Police's Strategic Subject List Reportedly Biased Along Racial Lines
439,31/07/2019,"[2448,2449,2450]","[""detroit-police-department""]","[""dataworks-plus""]","[""michael-oliver"",""black-people-in-detroit""]",A Black man was wrongfully detained by the Detroit Police Department as a result of a false facial recognition (FRT) result.,Detroit Police Wrongfully Arrested Black Man Due To Faulty Facial Recognition
440,25/11/2022,"[2452,2454,2498,2544,2731,2732]","[""baton-rouge-police-department""]","[""morphotrak"",""clearview-ai""]","[""black-people-in-louisiana"",""randall-reid""]",Louisiana police reportedly used a false facial recognition match and secured an arrest warrant for a Black man for thefts he did not commit.,Louisiana Police Wrongfully Arrested Black Man Using False Face Match
441,01/06/2019,"[2464,2465,2466,2467,2468]","[""korean-ministry-of-justice"",""korean-ministry-of-science-and-information-and-communication-technology""]","[""unnamed-korean-companies""]","[""travelers-in-korean-airports""]",Korean government's development of immigration screening system involving real-time facial recognition used airport travelers' data which was supplied by the Ministry of Justice without consent.,Korea Developed ID Screening System Using Airport Travelers' Data without Consent
446,01/01/2023,"[2505,2512,2542,2677,2830]","[""durham-police-department""]","[""shotspotter""]","[""mass-shooting-victims"",""durham-residents"",""durham-police-department""]","ShotSpotter did not detect gunshots and alert Durham police of a drive-by shooting in Durham, North Carolina which left five people in hospital on New Year's Day.",ShotSpotter Failed to Alert Authorities of Mass Shooting in North Carolina
452,11/01/2023,"[2518,2545]","[""openai"",""immunefi-users""]","[""openai""]","[""immunefi""]","ChatGPT-generated responses submitted to smart contract bug bounty platform Immunefi reportedly lacked details to help diagnose technical issues, which reportedly wasted the platform's time, prompting bans to submitters.","ChatGPT-Written Bug Reports Deemed ""Nonsense"" by White Hat Platform, Prompted Bans"
455,11/11/2022,"[2524,2541,2560,2603,2592,2597,2598]","[""cnet""]","[""unknown""]","[""cnet-readers""]","AI-written articles published by CNET reportedly contained factual errors which bypassed human editorial review, prompting the company to issue corrections and updates.",CNET's Published AI-Written Articles Ran into Quality and Accuracy Issues
457,11/11/2022,"[2543,2551,2552,2592,2597,2598]","[""cnet""]","[""unknown""]","[""plagiarized-entities"",""cnet-readers""]","CNET's use of generative AI to write articles allegedly ran into plagiarism issues, reproducing verbatim phrases from other published sources or making minor changes to existing texts such as altering capitalization, swapping out words for synonyms, and changing minor syntax.",Article-Writing AI by CNET Allegedly Committed Plagiarism
461,18/07/2008,"[2564,2565,2566,2567]","[""internal-revenue-service""]","[""internal-revenue-service""]","[""black-taxpayers""]","The IRS was auditing Black taxpayers more frequently than other groups allegedly due to the design of their algorithms, focusing on easier-to-conduct audits which inadvertently correlated with the group's pattern of tax filing errors.",IRS Audited Black Taxpayers More Frequently Reportedly Due to Algorithm
467,07/02/2023,"[2609,2611,2612,2613,2614,2615,2616,2617,2620,2622,2645,2646,2647,2963]","[""google""]","[""google""]","[""google"",""google-shareholders""]","Google's conversational AI ""Bard"" was shown in the company's promotional video providing false information about which satellite first took pictures of a planet outside the Earth's solar system, reportedly causing shares to temporarily plummet.",Google's Bard Shared Factually Inaccurate Info in Promo Video
470,08/02/2023,"[2641,2799]","[""microsoft""]","[""openai"",""microsoft""]","[""openai"",""microsoft""]","Reporters from TechCrunch issued a query to Microsoft Bing's ChatGPT feature, which cited an earlier example of ChatGPT disinformation discussed in a news article to substantiate the disinformation.",Bing Chat Response Cited ChatGPT Disinformation Example
472,08/10/2016,[2655],"[""new-york-police-department""]","[""unknown""]","[""racial-minorities""]",New York Police Department's use of facial recognition deployment of surveillance cameras were shown using crowdsourced volunteer data reinforcing discriminatory policing against minority communities.,NYPD's Deployment of Facial Recognition Cameras Reportedly Reinforced Biased Policing
475,02/06/2021,"[2671,2672,2834,2835,4059,6109]","[""mcdonald's""]","[""ibm""]","[""mcdonald's-customers""]","Between 2021 and mid-2024, McDonald's reportedly piloted an AI-enabled voice ordering system that was developed with IBM and based on its 2019 acquisition of Apprente. It was reportedly deployed at at over 100 U.S. drive-thrus. Social media posts alleged frequent misorders, such as adding unwanted items, mixing adjacent lane orders, and ignoring corrections. In June 2024, McDonald's confirmed it ended the IBM pilot, citing plans to explore alternative voice-AI vendors.",McDonald's Reportedly Ends IBM Partnership After AI Drive-Thru Ordering Errors at U.S. Locations
482,16/02/2023,"[2706,2707,2708,2709,2710,2711,2712,2713,2714,2715,2716,2717,2718,2719,2720,2721,2722,2735,2736,2737]","[""vanderbilt-university""]","[""openai""]","[""vanderbilt-university-students"",""vanderbilt-university""]","Vanderbilt University's Office of Equity, Diversity and Inclusion used ChatGPT to write an email addressing student body about the 2023 Michigan State University shooting, which was condemned as ""impersonal"" and ""lacking empathy"".",ChatGPT-Assisted University Email Addressing Mass Shooting Denounced by Students
483,02/02/2023,[2727],"[""telangana-police"",""medak-police""]","[""unknown""]","[""mohammed-khadeer""]","A resident in Medak, India died allegedly due to custodial torture by the local police, who misidentified him as a suspect in a theft case using facial recognition.",Indian Police Allegedly Tortured and Killed Innocent Man Following Facial Misidentification
484,18/01/2023,"[2729,2730,2803,2817]","[""us-customs-and-border-protection""]","[""us-customs-and-border-protection""]","[""haitian-asylum-seekers"",""african-asylum-seekers"",""black-asylum-seekers""]","CBP One's facial recognition feature was reportedly disproportionately failing to detect faces of Black asylum seekers from Haiti and African countries, effectively blocking their asylum applications.",US CBP App's Failure to Detect Black Faces Reportedly Blocked Asylum Applications
489,03/06/2019,[2777],"[""workday""]","[""workday""]","[""derek-mobley"",""applicants-with-disabilities"",""applicants-over-40"",""african-american-applicants""]","Workday's algorithmic screening systems were alleged in a lawsuit allowing employers to discriminate against African-Americans, people over 40, and people with disabilities.",Workday's AI Tools Allegedly Enabled Employers to Discriminate against Applicants of Protected Groups
490,20/02/2023,"[2778,2836,2837]","[""clarkesworld-story-submitters""]","[""openai""]","[""clarkesworld""]","Sci-fi magazine Clarkesworld temporarily stopped accepting submissions after receiving an overwhelming increase in LLM-generated submissions, citing issues around spam, plagiarism, detection tool unreliability, and authentication.",Clarkesworld Magazine Closed Down Submissions Due to Massive Increase in AI-Generated Stories
501,03/06/2019,[2842],"[""security-health-plan"",""navihealth""]","[""navihealth""]","[""frances-walter"",""elderly-patients""]","An elderly Wisconsin woman was algorithmically determined to have a rapid recovery, an output which the insurer based on to cut off payment for her treatment despite medical notes showing her still experiencing debilitating pain.",Length of Stay False Diagnosis Cut Off Insurer's Payment for Treatment of Elderly Woman
502,10/04/2017,"[2843,2844,2859]","[""allegheny-county""]","[""rhema-vaithianathan"",""emily-putnam-hornstein"",""centre-for-social-data-analytics""]","[""black-families-in-allegheny"",""households-with-disabled-people-in-allegheny"",""hackneys-family""]",Data analysis by the American Civil Liberty Union (ACLU) on Allegheny County's decision-support Family Screening Tool to predict child abuse or neglect risk found the tool resulting in higher screen-in rates for Black families and higher risk scores for households with disabled residents.,Pennsylvania County's Family Screening Tool Allegedly Exhibited Discriminatory Effects
506,29/03/2023,"[2869,2893,4330]","[""openai""]","[""openai""]","[""jonathan-turley""]",A lawyer in California asked the AI chatbot ChatGPT to generate a list of legal scholars who had sexually harassed someone. The chatbot produced a false story of Professor Jonathan Turley sexually harassing a student on a class trip.,ChatGPT Allegedly Produced False Accusation of Sexual Harassment
514,20/01/2023,[2901],"[""turnitin""]","[""turnitin""]","[""lucy-goetz"",""high-school-students""]","Turnitin's tool to detect writing generated by ChatGPT was reported for incorrectly flagging high school students' original essays as AI-generated, accusations of which are argued as reinforcement of bias from teachers due to the inability to compare against source documents.",Turnitin's ChatGPT-Detection Tool Falsely Flagged Student Essays as AI-Generated
515,25/11/2022,"[2905,2916,5342]","[""jefferson-parish-sheriff's-office""]","[""clearview-ai""]","[""randal-quran-reid""]","In November 2022, Randal ""Quran"" Reid was arrested in Georgia based on warrants from Louisiana that reportedly stemmed from a purportedly faulty facial recognition match using Clearview AI. Despite reportedly having never visited Louisiana, Reid was jailed for six days before authorities withdrew the warrants. No corroborating evidence had been gathered, and the technology's use was omitted from legal documents. In May 2025, Jefferson Parish settled with Reid for $200,000 in a federal civil rights lawsuit.",Facial Recognition Error Reportedly Leads to Wrongful Arrest of Georgia Man and $200K Settlement in Louisiana
517,15/02/2018,"[2909,2912]","[""new-york-police-department""]","[""unknown""]","[""unknown""]","A man was arrested for theft of socks from a TJ Maxx store under the guise of an eyewitness ID case, after the local police asked the store's security guard to confirm the facial recognition match produced using surveillance footage, despite him having an alibi at the time of the theft.",Man Arrested For Sock Theft by False Facial Match Despite Alibi
518,28/04/2017,[2911],"[""new-york-police-department"",""facial-identification-section""]","[""unknown""]","[""unknown""]","When the facial recognition search for a CVS theft suspect's face returned no useful matches due to the surveillance footage being obscured and highly pixelated, a New York City police detective continued the face search using Woody Harrelson's face allegedly due to his resemblance to the suspect's face, eventually leading to the arrest of an unknown victim.",New York Detective Misused Woody Harrelson's Face to Perform Face Recognition Search
519,03/04/2022,[2913],"[""starship-technologies""]","[""starship-technologies""]","[""starship-technologies""]","A Starship autonomous delivery robot struggled to navigate campus terrains of UCLA, reportedly getting stuck into a planter and falling off the stairs.",Starship Delivery Robot Ran into Problems Traversing Campus Terrains
520,08/05/2022,"[2914,3816]","[""amazon-fresh""]","[""amazon-fresh""]","[""amazon-fresh""]",Amazon Fresh's system of tracking cameras in its cashier-less stores was reported by shoppers for failing to detect items they purchased.,Amazon Fresh Cameras Failed to Register Purchased Items
527,08/05/2014,"[2931,2938]","[""uber"",""amazon""]","[""uber"",""amazon""]","[""uber-drivers"",""gig-workers"",""amazon-delivery-workers""]","Amazon and Uber were alleged in a multiyear ethnographic study using algorithmic systems based on gig workers' data to vary pay, such as by offering them lower wages for the same amount of work.",Tech Companies Reportedly Influenced Gig Workers' Behaviors Using Algorithms to Vary Pay for Same Amount of Work
531,15/09/2017,[2943],"[""transportation-security-administration""]","[""l3harris-technologies""]","[""transgender-travelers"",""gender-nonconforming-travelers""]","Transportation Security Administration (TSA)'s use of image-processing body scanners at airports led transgender and gender-nonconforming travelers to be subjected to allegedly discriminatory and invasive searches, such as being asked to remove undergarments in private rooms by officers not of their gender.",AI-Assisted Body Scanners Reportedly Subjected Transgender Travelers to Invasive Body Searches
532,20/06/2020,[2948],"[""us-citizenship-and-immigration-services""]","[""unknown""]","[""anonymous-pashto-speaking-refugee"",""pashto-speaking-asylum-seekers"",""dari-speaking-asylum-seekers""]","A Pashto-speaking refugee's asylum claim was denied by a US agency for a discrepancy between oral and written recount of an event allegedly due to an error of their automated translation tool which swapped pronouns of her written statement from ""I"" to ""we"".",AI translation is jeopardizing Afghan asylum claims
536,10/12/2012,"[2976,2977]","[""new-jersey-transit""]","[""national-weather-service""]","[""new-jersey-transit"",""new-jersey-transit-passengers""]","New Jersey Transit's use of a federal government storm modeling software underestimated the threat of storm surges to the Meadows Maintenance Complex, leaving millions of dollars worth of equipment in the rail yard before Hurricane Sandy struck.",NJ Transit's Use of Modeling Software Miscalculated Storm Surge Threat Level
538,15/05/2023,"[2993,2994,2995,2996,2997]","[""jared-mumm""]","[""openai""]","[""texas-aandm-university-students""]","A Texas A&M-Commerce professor reportedly informed his class of his misuse of ChatGPT to detect whether student submissions had been generated by the chatbot itself, which informed their graduation status.",Texas A&M Professor Misused ChatGPT to Detect AI Text Generation in Student Submissions
541,04/05/2023,"[3005,3006,3007,3008,3009,3010,3011,3014,3015,3016,3017,3018,3019,3020,3021,3022,3023,3024,3025,3026,3027,3028,3029,3030,3031,3032,3033,3034,3036,3037,3038,3039,3040,3041,3042,3043,3044,3045,3046,3047,3048,3049,3050,3051,3052,3053,3054,3055,3056,3057,3098,3116,3149,3150,3151,3155,3181,3183]","[""steven-a.-schwartz"",""peter-loduca""]","[""openai""]","[""roberto-mata"",""peter-loduca"",""steven-a.-schwartz""]","A lawyer in Mata v. Avianca, Inc. used ChatGPT for research. ChatGPT hallucinated court cases, which the lawyer then presented in court. The court determined the cases did not exist.",ChatGPT Reportedly Produced False Court Case Law Presented by Legal Counsel in Court
545,29/05/2023,"[3103,3104,3105,3106,3107,3108,3109,3110,3111,3112,3113,3114,3115,3117,3118,3119,3120,3121,3122,3123,3124,3125,3126,3127,3128,3129,3130,3131,3132,3133,3134,3135,3136,3137,3138,3139,3140,3141,3142,3143,3144,3145,3146,3147,3148,3153]","[""national-eating-disorders-association"",""cass""]","[""cass""]","[""people-with-eating-disorders""]","The National Eating Disorders Association (NEDA) has shut down its chatbot named Tessa after it gave weight-loss advice to users seeking help for eating disorders. The incident has raised concerns about the risks of using chatbots and AI assistants in healthcare settings, particularly in addressing sensitive issues like eating disorders. NEDA is investigating the matter, emphasizing the need for caution and accuracy when utilizing technology to provide mental health support.",Chatbot Tessa gives unauthorized diet advice to users seeking help for eating disorders
546,31/05/2019,"[3159,3161,3162]","[""national-aid-fund""]","[""the-world-bank"",""unicef"",""world-food-programme""]","[""jordanians-in-poverty""]","Takaful cash transfer program's algorithm which ranks families by their economic vulnerability level to determine financial assistance reportedly oversimplified people's economic situation, fueling social tension and perceptions of unfairness.",Algorithm to Distribute Social Welfare Reported for Oversimplifying Economic Vulnerability
549,05/01/2023,[3164],"[""wendy's"",""mcdonald's"",""hardee's""]","[""wendy's"",""mcdonald's"",""hardee's""]","[""fast-food-job-applicants"",""amanda-claypool""]","McDonald's, Wendy's, and Hardee's AI chatbots deployed to pre-screen job candidates and schedule interviews reportedly ran into issues such as not giving useful submission instructions, failing to relay information to the manager, and scheduling an interview when the manager was not available.",Fast Food Chains' AI Chatbots Failed to Assist Job Applicants with Scheduling Interviews
557,24/06/2020,"[3178,3190,3191,3192]","[""miami-police-department""]","[""clearview-ai""]","[""oriana-albornoz"",""george-floyd-protest-participants""]","Miami Police's arrest report for a George Floyd protestor did not disclose use of facial recognition, which allegedly did not meet the legal threshold for probable cause for arrest.",Miami Police Deployed Facial Recognition to Arrest George Floyd Protestor Allegedly without Cause
558,07/08/2020,"[3184,3188,3189]","[""new-york-city-police-department""]","[""clearview-ai""]","[""derrick-ingram"",""black-lives-matter-activists""]","Black Lives Matter activists alleged being targeted for arrest by New York Police using facial recognition, interfering with their right to protest.",Activists Allege NYPD's Application of Facial Recognition Interfered with Right to Protest
559,30/06/2023,"[3193,3269]","[""openai""]","[""openai""]","[""research-grant-administrators"",""research-grant-applicants""]","Peer reviewers of Australian government grant applications inserted applicants' work into generative AI systems such as ChatGPT to generate assessment reports, which allegedly posed confidentiality and security issues.","Grant Reviewers Fed Applications into Generative AI to Produce Reports, Allegedly Breaching Confidentiality"
562,30/11/2022,[3201],"[""openai""]","[""openai""]","[""publishing-editors"",""publishers""]","A surge in low-standard AI-generated content such as by ChatGPT was reported by publishers, which negatively impacted submission management process and editors' workflow.",Uptick in Low-Quality AI-Produced Content Degraded Publishers' Submission Management
