incident_id,date,reports,Alleged deployer of AI system,Alleged developer of AI system,Alleged harmed or nearly harmed parties,description,title
2,05/12/2018,"[139,141,142,143,144,145,146,148,149,150,151,152,153,154,155,156,157]","[""amazon""]","[""amazon""]","[""warehouse-workers""]",Twenty-four Amazon workers in New Jersey were hospitalized after a robot punctured a can of bear repellent spray in a warehouse.,Warehouse robot ruptures can of bear spray and injures workers
9,25/02/2012,"[1329,1330,1331,1332,1333,1334,1335]","[""new-york-city-dept.-of-education""]","[""new-york-city-dept.-of-education""]","[""teachers""]",An algorithm used to rate the effectiveness of school teachers in New York has resulted in thousands of disputes of its results.,NY City School Teacher Evaluation Algorithm Contested
10,14/08/2014,"[16,17,18,19,20,21,22,23,24,25]","[""starbucks""]","[""kronos""]","[""starbucks-employees""]","Kronos's scheduling algorithm and its use by Starbucks managers allegedly negatively impacted financial and scheduling stability for Starbucks employees, which disadvantaged wage workers.",Kronos Scheduling Algorithm Allegedly Caused Financial Issues for Starbucks Employees
11,23/05/2016,"[29,30,31,32,33,35,36,37,38,39,40,41,1371,1372,1373]","[""northpointe""]","[""northpointe""]","[""accused-people""]",An algorithm developed by Northpointe and used in the penal system is two times more likely to incorrectly label a black person as a high-risk re-offender and is two times more likely to incorrectly label a white person as low-risk for reoffense according to a ProPublica review.,Northpointe Risk Models
27,26/09/1983,"[342,343,344,345,346,347,349,350,351,352,353,354,355,356,357,358,359,360,361,363,364,365,366,367,368,370,371]","[""soviet-union""]","[""soviet-union""]","[""all-life-on-earth""]",An alert of five incoming intercontinental ballistic missiles was properly identified as a false-positive by the Soviet Union operator Stanislov Petrov.,Nuclear False Alarm
28,08/05/2010,"[390,391,392,393,394,395,396,397,398,399,400,401,402,403,404,405,406,407,408,409,410,411,412,413,414,415,416,417,418,419]","[""navinder-sarao"",""waddell-and-reed"",""barclays-capital""]","[""navinder-sarao"",""waddell-and-reed"",""barclays-capital""]","[""market-participants""]",A modified algorithm was able to cause dramatic price volatility and disrupted trading in the US stock exchange.,2010 Market Flash Crash
30,08/10/2016,"[424,425,426,428,430,431,432,433,434,435,436,437,438,439,440,441,442,443,444,445,446,447,448,449,450,451,452,453]","[""tesla""]","[""tesla""]","[""tesla""]","The goal of manufacturing 2,500 Tesla Model 3's per week was falling short by 500 cars/week, and employees had to be ""borrowed"" from Panasonic in a shared factory to help hand-assemble lithium batteries for Tesla.",Poor Performance of Tesla Factory Robots
35,18/10/2014,"[539,540,541,543,544,545,547,548,549,550,551,555,558,562,563,564,565,566,567,568]","[""unknown""]","[""unknown""]","[""ibrahim-diallo""]","An employee was laid off, allegedly by an artificially intelligent personnel system, and blocked from access to the building and computer systems without their knowledge.",Employee Automatically Terminated by Computer Program
37,10/08/2016,"[599,600,601,602,603,604,605,606,607,608,609,610,611,612,613,614,615,616,617,618,619,620,621,622,623,624,625,626,627,628,1498,2253,2461,6123]","[""amazon""]","[""amazon""]","[""amazon-applicants"",""women-applying-to-amazon""]","Between 2014 and 2017, Amazon reportedly developed an AI-powered recruiting tool to score job applicants, trained on a decade of resumes purportedly drawn largely from men. Media reports say the system learned to favor male candidates, penalizing terms like ""women's"" and graduates from certain all-women's colleges. Efforts to remove these biases reportedly did not guarantee fairness, and the project was ultimately abandoned. Amazon reportedly states recruiters never solely relied on the tool.",Amazon's Experimental Hiring Tool Allegedly Displayed Gender Bias in Candidate Rankings
40,23/05/2016,"[697,699,700,701,702,703,704,705,706,707,708,709,711,715,716,717,718,1338,1357,1358,1359]","[""equivant""]","[""equivant""]","[""accused-people""]","Correctional Offender Management Profiling for Alternative Sanctions (COMPAS), a recidivism risk-assessment algorithmic tool used in the judicial system to assess likelihood of defendants' recidivism, is found to be less accurate than random untrained human evaluators.",COMPAS Algorithm Performs Poorly in Crime Recidivism Prediction
48,07/12/2016,"[838,839,840,842,843,844,845,846,847,848,849,850,851,853,855,857,858,859,860,862,863]","[""new-zealand""]","[""new-zealand""]","[""asian-people""]",New Zealand passport robot reader rejects the application of an applicant with Asian descent and says his eyes are closed.,Passport checker Detects Asian man's Eyes as Closed
51,12/07/2016,"[931,932,933,934,935,936,938,939,940,942,943,944,945,946,948,949,950,951,952,953,954,955,956,957,958,959,1765]","[""stanford-shopping-center""]","[""knightscope""]","[""child""]","On July 7, 2016, a Knightscope K5 autonomous security robot collided with a 16-month old boy while patrolling the Stanford Shopping Center in Palo Alto, CA.",Security Robot Rolls Over Child in Mall
54,18/11/2015,"[1007,1008,1009,1010,1014,1015,1017,1019,1347,1349,1524,1525,1526,1013,1011,1018,1012]","[""predpol"",""oakland-police-department""]","[""predpol""]","[""oakland-residents""]",Predictive policing algorithms meant to aid law enforcement by predicting future crime show signs of biased output.,Predictive Policing Biases of PredPol
57,01/07/2015,"[1048,1049,1050,1051,1052,1054,1055,1056,1058,1059,1060,1061,1062,1063,1064,1065,1066,1067,1068,1069,1070,1071,1072,1073,1074,1075,1076,1077,1346,1437,1618,1619,2369,2372,2373,2374,2375,2419,3167]","[""australian-department-of-human-services""]","[""centrelink""]","[""australian-welfare-recipients""]","Australian Department of Human Services (DHS)'s automated debt assessment system issued false or incorrect debt notices to hundreds of thousands of people, resulting in years-long lawsuits and damages to welfare recipients.",Australian Automated Debt Assessment System Issued False Notices to Thousands
64,22/01/2018,[1137],"[""heriot-watt-university"",""margiotta""]","[""heriot-watt-university""]","[""store-patrons""]","Heriot-Watt Univeristy in Scotland developed an artificially intelligent grocery store robot, Fabio, who provided unhelpful answers to customer's questions and ""scared away"" multiple customers, according to the grocery store Margiotta.",Customer Service Robot Scares Away Customers
74,30/01/2020,"[1336,1400,1467,1484,1543,1837,2027,2028,2029,2734,3964]","[""detroit-police-department""]","[""dataworks-plus""]","[""robert-julian-borchak-williams"",""black-people-in-detroit""]",A Black man was wrongfully detained by the Detroit Police Department as a result of a false facial recognition (FRT) result.,Detroit Police Wrongfully Arrested Black Man Due To Faulty FRT
76,09/10/2020,[1339],"[""buenos-aires-city-government""]","[""unknown""]","[""buenos-aires-children""]",Buenos Aires city government uses a facial recognition system that has led to numerous false arrests.,Live facial recognition is tracking kids suspected of being criminals
77,04/10/2019,"[1340,1390,1878,2201,2202]","[""knightscope""]","[""knightscope""]","[""cogo-guebara"",""unnamed-woman-injured-in-the-fight""]","A Knightscope K5 autonomous ""police"" robot patrolling Huntington Park, California failed to respond to an onlooker who attempted to activate its emergency alert button when a nearby fight broke out.",Knightscope's Park Patrol Robot Ignored Bystander Pressing Emergency Button to Alert Police about Fight
78,06/07/2020,[1341],"[""international-baccalaurette""]","[""international-baccalaurette""]","[""international-baccalaureate-students""]","In response to the Covid-19 pandemic, the International Baccalaureate final exams were replaced by a calculated score, prompting complaints of unfairness from teachers and students.",Meet the Secret Algorithm That's Keeping Students Out of College
86,08/10/2020,"[1386,2038]","[""irish-department-of-education-and-skills""]","[""irish-department-of-education-and-skills""]","[""leaving-certificate-exam-takers"",""irish-department-of-education-and-skills""]",Errors in Irish Department of Education's algorithm to calculate students' Leaving Certificate exam grades resulted in thousands of inaccurate scores.,Coding Errors in Leaving Certificate Grading Algorithm Caused Inaccurate Scores in Ireland
91,18/12/2020,"[1391,1392,1463,1720,1779]","[""stanford-medical-center""]","[""stanford-medical-center""]","[""stanford-medical-frontline-workers"",""stanford-medical-residents""]","In 2020, Stanford Medical Center's distribution algorithm only designated 7 of 5,000 vaccines to Medical Residents, who are frontline workers regularly exposed to COVID-19.",Frontline workers protest at Stanford after hospital distributed vaccine to administrators
94,27/11/2020,"[1395,1473]","[""deliveroo""]","[""deliveroo""]","[""deliveroo-workers-with-legitimate-reasons-for-cancelling-shifts"",""deliveroo-workers""]","In December 2020, an Italian court ruled that Deliveroo's employee 'reliability' algorithm illegally discriminated against workers with legitimate reasons for cancelling shifts.",Court Rules Deliveroo Used 'Discriminatory' Algorithm
95,06/11/2019,"[2133,2132,1397,2194]","[""hirevue""]","[""hirevue""]","[""job-applicants-using-hirevue"",""hirevue-customers""]","In January 2021, HireVue removed the controversial AI expression tracking tool from its virtual job interview software.",Job Screening Service Halts Facial Analysis of Applicants
96,08/05/2017,[1398],"[""houston-independent-school-district""]","[""sas-institute""]","[""houston-independent-school-district-teachers""]","On May 4, 2017, a U.S. federal judge advanced teachers' claims that the Houston Independent School District's algorithmic teacher evaluations violated their due process rights to their jobs by not allowing them to review the grounds of their termination.",Houston Schools Must Face Teacher Evaluation Lawsuit
99,01/01/2012,[1402],"[""university-of-massachusetts-amherst"",""university-of-wisconsin-milwaukee"",""university-of-houston"",""texas-aandm-university"",""georgia-state-university"",""more-than-500-colleges""]","[""eab""]","[""black-college-students"",""latinx-college-students"",""indigenous-students""]",Several major universities are using a tool that uses race as one factor to predict student success.,Major Universities Are Using Race as a '“High Impact Predictor' of Student Success
100,17/03/2021,[1403],"[""french-welfare-offices""]","[""unknown""]","[""lucie-inland""]",A French welfare office using software to automatically evaluate cases incorrectly notified a woman receiving benefits that she owed '542.,How French welfare services are creating 'robo-debt'
101,01/09/2018,"[1404,1575,1863,2570,2805,2845]","[""dutch-tax-authority""]","[""unknown""]","[""dutch-tax-authority"",""dutch-families""]","A childcare benefits system in the Netherlands falsely accused thousands of families of fraud, in part due to an algorithm that treated having a second nationality as a risk factor.",Dutch Families Wrongfully Accused of Tax Fraud Due to Discriminatory Algorithm
104,12/02/2021,[1407],"[""california-department-of-public-health""]","[""blue-shield-of-california""]","[""california-low-income-neighborhoods"",""california-communities-of-color""]","California's vaccine-distribution algorithm used ZIP codes as opposed to census tracts in its decision-making, which critics said undermined equity and access for vulnerable communities who are largely low-income, underserved neighborhoods with low Healthy Places Index scores.","California's Algorithm Considered ZIP Codes in Vaccine Distribution, Allegedly Excluding Low-Income Neighborhoods and Communities of Color"
110,01/01/2016,"[1413,2651]","[""arkansas-department-of-human-services""]","[""interrai""]","[""arkansas-medicaid-waiver-program-beneficiaries"",""arkansas-healthcare-workers""]","Beneficiaries of the Arkansas Department of Human Services (DHS)'s Medicaid waiver program were allocated excessively fewer hours of caretaker visit via an algorithm deployed to boost efficiency, which reportedly contained errors and whose outputs varied wildly despite small input changes.",Arkansas's Opaque Algorithm to Allocate Health Care Excessively Cut Down Hours for Beneficiaries
111,25/09/2015,"[1426,1427,1428,1429,1430]","[""amazon-flex""]","[""amazon""]","[""amazon-flex-employees"",""amazon-flex-drivers""]",Amazon Flex's contract delivery drivers were dismissed using a minimally human-interfered automated employee performance evaluation based on indicators impacted by out-of-driver's-control factors and without having a chance to defend against or appeal the decision.,Amazon Flex Drivers Allegedly Fired via Automated Employee Evaluations
112,09/10/2012,"[2831,2623,2496,2495,2250,1821,1810,1436,1435,1434,1433,1432,3654,4057,4058]","[""troy-police-department"",""syracuse-police-department"",""san-francisco-police-department"",""san-antonio-police-department"",""new-york-city-police-department"",""fall-river-police-department"",""chicago-police-department""]","[""shotspotter""]","[""troy-residents"",""troy-police-department"",""syracuse-residents"",""syracuse-police-department"",""san-francisco-residents"",""san-francisco-police-department"",""san-antonio-residents"",""san-antonio-police-department"",""new-york-city-residents"",""new-york-city-police-department"",""fall-river-residents"",""fall-river-police-department"",""chicago-residents"",""chicago-police-department""]","ShotSpotter algorithmic systems locating gunshots were reported by police departments for containing high false positive rates and wasting police resources, prompting discontinuation.",Police Departments Reported ShotSpotter as Unreliable and Wasteful
116,20/09/2021,"[1441,1803]","[""amazon""]","[""netradyne""]","[""amazon-delivery-drivers"",""amazon-workers""]","Amazon's automated performance evaluation system involving AI-powered cameras incorrectly punished delivery drivers for non-existent mistakes, impacting their chances for bonuses and rewards.",Amazon's AI Cameras Incorrectly Penalized Delivery Drivers for Mistakes They Did Not Make
119,03/08/2021,"[1444,1800,1801,1802]","[""xsolla""]","[""unknown""]","[""xsolla-employees""]","Xsolla CEO fired more than a hundred employees from his company in Perm, Russia, based on big data analysis of their remote digitized-work activity, which critics said was violating employee's privacy, outdated, and extremely ineffective.",Xsolla Employees Fired by CEO Allegedly via Big Data Analytics of Work Activities
123,01/08/2021,"[1449,2651,2705,3013,3012]","[""university-of-michigan-hospital""]","[""epic-systems""]","[""sepsis-patients""]","Epic System's sepsis prediction algorithms was shown by investigators at the University of Michigan Hospital to have high rates of false positives and false negatives, allegedly delivering inaccurate and irrelevant information on patients, contrasting sharply with their published claims.",Epic Systems's Sepsis Prediction Algorithms Revealed to Have High Error Rates on Seriously Ill Patients
124,24/10/2019,"[1450,1522,2262,2652,2651,2704,2856]","[""unnamed-large-academic-hospital""]","[""optum""]","[""black-patients""]","Researchers analyzing an Optum algorithm used by a large academic hospital reportedly found evidence that it tended to under-predict the health care needs of Black patients, which in turn appeared to result in lower prioritization for extra care programs compared with white patients exhibiting similar health profiles.",Optum Algorithmic Health Risk Scores Reportedly Underestimated Black Patients' Needs
125,29/09/2020,"[1451,1452,1460]","[""amazon""]","[""amazon""]","[""amazon-fulfillment-center-workers""]",Amazon's robotic fulfillment centers have higher serious injury rates.,Amazon's Robotic Fulfillment Centers Have Higher Serious Injury Rates
126,16/07/2021,"[1453,1454,1455,1532]","[""ocado""]","[""ocado""]","[""ocado""]","A collision involving three robots at an Ocado's warehouse in Erith, UK, resulting in a fire but no reports of injuries.","Three Robots Collided, Sparking Fire in a Grocer's Warehouse in UK "
127,06/06/2020,"[1456,1457,1458,1461,1486,1487,1488,1489,1490,1491,1492,1493]","[""microsoft"",""msn.com""]","[""microsoft""]","[""jade-thirlwall"",""leigh-anne-pinnock""]","A news story published on MSN.com featured a photo of the wrong mixed-race person that was allegedly selected by an algorithm, following Microsoft's layoff and replacement of journalists and editorial workers at its organizations with AI systems.",Microsoft's Algorithm Allegedly Selected Photo of the Wrong Mixed-Race Person Featured in a News Story
131,04/12/2020,"[1465,1771]","[""california-bar's-committee-of-bar-examiners""]","[""examsoft""]","[""california-bar-exam-takers"",""flagged-california-bar-exam-takers""]","The proctoring algorithm used in a California bar exam cited a third of thousands of applicants as cheaters, resulting in allegations where exam takers were instructed to prove otherwise without seeing their incriminating video evidence.",Proctoring Algorithm in Online California Bar Exam Flagged an Unusually High Number of Alleged Cheaters
134,25/12/2020,"[1469,1951]","[""fuzhou-zhongfang-marlboro-mall""]","[""unknown""]","[""fuzhou-zhongfang-marlboro-mall-goers""]","A shopping guide robot deployed by the Fuzhou Zhongfang Marlboro Mall was shown on video allegedly walking to the escalator by itself, falling down, and knocking over passengers, which prompted its suspension.","Robot in Chinese Shopping Mall Fell off the Escalator, Knocking down Passengers"
135,01/12/2012,"[1470,1871]","[""university-of-texas-at-austin's-department-of-computer-science""]","[""university-of-texas-at-austin-researchers""]","[""university-of-texas-at-austin-phd-applicants-of-marginalized-groups""]","The University of Texas at Austin's Department of Computer Science's assistive algorithm to assess PhD applicants ""GRADE"" raised concerns among faculty about worsening historical inequalities for marginalized candidates, prompting its suspension.",UT Austin GRADE Algorithm Allegedly Reinforced Historical Inequalities
137,11/01/2021,[1474],"[""israeli-tax-authority""]","[""israeli-tax-authority""]","[""moshe-har-shemesh"",""israeli-people-having-tax-fines""]","An Israeli farmer was imposed a computer generated fine by the tax authority, who allegedly were not able to explain its calculation, and refused to disclose the program and its source code.","Israeli Tax Authority Employed Opaque Algorithm to Impose Fines, Reportedly Refusing to Provide an Explanation for Amount Calculation to a Farmer"
138,21/01/2020,"[1475,1505,1555,1556,2442,2434]","[""university-of-illinois""]","[""proctorio""]","[""university-of-illinois-students-of-color"",""university-of-illinois-students""]","Proctorio's remote-testing software were reported by students at the University of Illinois Urbana-Champaign for issues regarding privacy, accessibility, differential performance on darker-skinned students.",Alleged Issues with Proctorio's Remote-Testing AI Prompted Suspension by University
140,01/06/2020,[1478],"[""university-of-toronto""]","[""proctoru""]","[""university-of-toronto-bipoc-students""]","An exam monitoring service used by the University of Toronto was alleged by its students to have provided discriminatory check-in experiences via its facial recognition's failure to verify passport photo, disproportionately enhancing disadvantaging stress level for BIPOC students.",ProctorU's Identity Verification and Exam Monitoring Systems Provided Allegedly Discriminatory Experiences for BIPOC Students
149,02/11/2021,"[1500,1501,1890,2925]","[""zillow""]","[""zillow-offers""]","[""zillow-offers-staff"",""zillow""]","Zillow's AI-powered predictive pricing tool Zestimate was allegedly not able to accurately forecast housing prices three to six months in advance due to rapid market changes, prompting division shutdown and layoff of a few thousand employees.",Zillow Shut Down Zillow Offers Division Allegedly Due to Predictive Pricing Tool's Insufficient Accuracy
152,13/07/2021,"[1509,1510]","[""softbank""]","[""aldebaran"",""softbank-robotics""]","[""softbank""]","SoftBank's robot allegedly kept making mechanical errors, taking unplanned breaks, failing to recognize previously-met people, and breaking down during practice runs.","SoftBank's Humanoid Robot, Pepper, Reportedly Frequently Made Errors, Prompting Dismissal"
154,26/01/2022,[1512],"[""us-department-of-justice""]","[""us-department-of-justice""]","[""inmates-of-color""]","Department of Justice's inmate-recidivism risk assessment tool was reported to have produced racially uneven results, misclassifying risk levels for inmates of color.",Justice Department's Recidivism Risk Algorithm PATTERN Allegedly Caused Persistent Disparities Along Racial Lines
157,15/03/2021,[1516],"[""amazon""]","[""amazon""]","[""amazon-workers"",""amazon-delivery-drivers""]","A lawsuit cited Amazon as liable in a crash involving its delivery driver, alleging that Amazon's AI-powered driver monitoring system pushed drivers to prioritize speed over safety.","Amazon's Monitoring System Allegedly Pushed Delivery Drivers to Prioritize Speed over Safety, Leading to Crash"
162,01/01/2014,[1531],"[""ets""]","[""ets""]","[""uk-ets-past-test-takers"",""uk-ets-test-takers"",""uk-home-office""]"," International testing organization ETS admits voice recognition as evidence of cheating for thousands of previous TOEIC test-takers that reportedly included wrongfully accused people, causing them to be deported without an appeal process or seeing their incriminating evidence.","ETS Used Allegedly Flawed Voice Recognition Evidence to Accuse and Assess Scale of Cheating, Causing Thousands to be Deported from the UK"
171,18/10/2021,[1549],"[""bath-government""]","[""unknown""]","[""paula-knight"",""bath-officials"",""uk-public""]",A Bath resident was wrongly fined by the local officials because an automated license plate recognition camera misread the text on her shirt as a license plate number.,"Traffic Camera Misread Text on Pedestrian's Shirt as License Plate, Causing UK Officials to Issue Fine to an Unrelated Person"
172,01/07/2020,"[1550,3859,3912]","[""appriss"",""narxcare"",""avertd""]","[""appriss""]","[""american-physicians"",""american-pharmacists"",""american-patients-of-minority-groups"",""american-patients""]","NarxCare's overdose risk algorithm, lacking peer-reviewed validation, uses sensitive data like doctor visits, prescriptions, and possibly genetic information, leading to significant biases against women and Black patients. Factors like sexual abuse and criminal records exacerbate stigmas and disparities, often resulting in unjust denial of necessary pain medication. The newly approved AvertD genetic test shares similar issues, further complicating and potentially harming medical treatment decisions.",NarxCare's Risk Score Model Allegedly Lacked Validation and Trained on Data with High Risk of Bias
173,30/07/2021,[1551],"[""unknown""]","[""unknown""]","[""doctors"",""covid-patients""]","AI tools failed to sufficiently predict COVID patients, some potentially harmful.","AI Tools Failed to Sufficiently Predict COVID Patients, Some Potentially Harmful"
176,02/03/2022,[1557],"[""oregon-state-university""]","[""starship-technologies""]","[""oregon-state-university"",""freight-train-crew""]"," A Starship food delivery robot deployed by Oregon State University reportedly failed to cross the railroad, becoming stranded, and ending up being struck by an oncoming freight train.","Starship's Autonomous Food Delivery Robot Allegedly Stranded at Railroad Crossing in Oregon, Run over by Freight Train"
180,19/02/2020,"[1564,1582,2236]","[""malaysian-judiciary"",""malaysian-courts""]","[""sarawak-information-systems""]","[""malaysian-convicted-people""]","The AI system used by the Malaysian judiciary which explicitly considered age, employment, and socio-economic data provided sentencing to a drug possession case that was alleged by lawyer to be disproportionately high for the crime committed.",Algorithm Used by the Malaysian Judiciary Reportedly Recommended Unusually High Sentencing to a Drug Possession Case
184,12/04/2018,"[1581,1584,1899]","[""companhia-do-metropolitano-de-sao-paulo""]","[""securos""]","[""sao-paulo-metro-users"",""sao-paulo-citizens""]"," A facial recognition program rolled out by Sao Paulo Metro Stations was suspended following a court ruling in response to a lawsuit by civil society organizations, who cited fear of it being integrated with other electronic surveillance entities without consent, and lack of transparency about the biometric data collection process of metro users.",Facial Recognition Program in Sao Paulo Metro Stations Suspended for Illegal and Disproportionate Violation of Citizens' Right to Privacy
186,26/07/2007,"[1590,1591,1592,1593,1788,1933,1934]","[""spanish-ministry-of-interior""]","[""spanish-secretary-of-state-for-security"",""spanish-ministry-of-interior""]","[""spanish-victims-of-gender-violence""]"," In Spain, the algorithm that assesses recidivism risk in gender violence, VioGen, have critically underestimated the level of risk in a series of cases that ended in homicide of women and children since its first deployment.","Algorithm Assessing Risk Faced by Victims of Gender Violence Misclassified Low-Risk Cases, Allegedly Leading to Homicide of Women and Children in Spain"
